{
  "adversarialChecks": [
    {
      "class": "boundary_value",
      "description": "--max-candidates 0 generates zero candidates",
      "id": "ADV-1",
      "verify": {
        "type": "exec",
        "value": "bash tests/test-signum-evolve-v0.sh"
      }
    }
  ],
  "changeType": "cli_tooling",
  "coveredCoverageClasses": [
    "boundary_value"
  ],
  "happyPathChecks": [
    {
      "description": "normal generate leaderboard export works",
      "id": "HP-1",
      "verify": {
        "type": "exec",
        "value": "bash tests/test-signum-evolve-v0.sh"
      }
    }
  ],
  "missingCoverageClasses": [
    "idempotency",
    "path_handling",
    "config_source_of_truth",
    "generated_output_isolation"
  ],
  "requiredCoverageClasses": [
    "boundary_value",
    "idempotency",
    "path_handling",
    "config_source_of_truth",
    "generated_output_isolation"
  ],
  "riskLevel": "medium",
  "schemaVersion": "1.0"
}
