{
  "adversarialChecks": [
    {
      "class": "boundary_value",
      "description": "--max-candidates 0 generates zero candidates",
      "id": "ADV-1",
      "verify": {
        "type": "exec",
        "value": "bash tests/test-signum-evolve-v0.sh"
      }
    },
    {
      "class": "idempotency",
      "description": "repeated run-id cleanup removes stale candidates",
      "id": "ADV-2",
      "verify": {
        "type": "exec",
        "value": "bash tests/test-signum-evolve-v0.sh"
      }
    },
    {
      "class": "path_handling",
      "description": "absolute external config path is handled",
      "id": "ADV-3",
      "verify": {
        "type": "exec",
        "value": "bash tests/test-signum-evolve-v0.sh"
      }
    },
    {
      "class": "config_source_of_truth",
      "description": "configured baseline is used",
      "id": "ADV-4",
      "verify": {
        "type": "exec",
        "value": "bash tests/test-signum-evolve-v0.sh"
      }
    },
    {
      "class": "generated_output_isolation",
      "description": "generated output is isolated from source files",
      "id": "ADV-5",
      "verify": {
        "type": "exec",
        "value": "bash tests/test-signum-evolve-v0.sh"
      }
    }
  ],
  "changeType": "cli_tooling",
  "coveredCoverageClasses": [
    "boundary_value",
    "idempotency",
    "path_handling",
    "config_source_of_truth",
    "generated_output_isolation"
  ],
  "happyPathChecks": [
    {
      "description": "normal generate leaderboard export works",
      "id": "HP-1",
      "verify": {
        "type": "exec",
        "value": "bash tests/test-signum-evolve-v0.sh"
      }
    }
  ],
  "missingCoverageClasses": [],
  "requiredCoverageClasses": [
    "boundary_value",
    "idempotency",
    "path_handling",
    "config_source_of_truth",
    "generated_output_isolation"
  ],
  "riskLevel": "medium",
  "schemaVersion": "1.0"
}
